file_name,caption
1.png,A mountain with rugged peaks in Chinese landscape painting
2.png,A person on a shore with trees in Chinese landscape painting
3.png,A village nestled among mountains and trees in Chinese landscape painting
4.png,Birds on a tree in Chinese landscape painting
5.png,Trees in Chinese landscape painting
6.png,Trees on a montain in wind in Chinese landscape painting
7.png,Trees on a mountain in Chinese landscape painting
8.png,Village in mountains in Chinese landscape painting
